,sigla,name,school,area,category,credits
2222,EDU3899,Trabajo Final de Egreso 2,Educación,,,10
2223,EDU4030,Prácticas de Investigación,Educación,,,10
2224,EDU4035,Estudio Dirigido,Educación,,,10
2225,EDU4037,Estudio Dirigido II,Educación,,,10
2226,EDU4038,Estudio Dirigido III,Educación,,,10
2227,EDU4044,Seminario Problemas Contemporáneos en Educación,Educación,,,10
2228,EDU4045,Introducción a los Métodos Cuantitativos en Educación,Educación,,,10
2229,EDU4048,Estudio Dirigido Metodológico,Educación,,,10
2230,EDU4050,Métodos de Investigación Cuantitativa en Estudios de Gran Escala,Educación,,,10
2231,EDU4051,Investigación Postcualitativa: Métodos Narrativos y Basados en las Artes,Educación,,,10
2232,EDU4060,Actividad Anual de Seguimiento I,Educación,,,0
2233,EDU4061,Actividad Anual de Seguimiento II,Educación,,,0
2234,EDU4062,Autoría Artículo Científico o Patente,Educación,,,0
2235,EDU4063,Pasantía,Educación,,,0
2236,EDU4064,Presentación en Conferencia,Educación,,,0
2237,EDU4220,Diseños en Investigación Educacional,Educación,,,10
2238,EDU4221,Seminario de Investigación I,Educación,,,10
2239,EDU4224,Proyecto de Tesis I,Educación,,,20
2240,EDU4226,Tesis I,Educación,,,50
2241,EDU4227,Tesis II,Educación,,,50
2242,EDU4228,Tesis III,Educación,,,50
2243,EDU4229,Tesis IV,Educación,,,50
2244,EDU4230,Seminario de Investigación III,Educación,,,10
2245,EDU552,Didáctica de la Educación Física I,Educación,,,10
2246,EDU553,Práctica Pedagógica en Educación Física y Salud III,Educación,,,15
2247,EDU556,Dimensión Ética de la Profesión Docente,Educación,,,5
2248,EDU558,Práctica Profesional Pedagogía en Educación Física y Salud (Ed. Básica),Educación,,,20
2249,ESM01EC,Economía y Administración,Economía Y Administración,,,7
2250,ESM02EC,Microeconomía,Economía Y Administración,,,10
2251,ESM03EC,Macroeconomía I,Economía Y Administración,,,9
2252,ESM04EC,Macroeconomía II,Economía Y Administración,,,7
2253,MEC284,Electrocardiografia Practica,Escuela De Medicina,,,5
2254,ESM01ED,Metodología de la Investigación,Educación,,,7
2255,ESM02ED,Teoría de la Educación,Educación,,,10
2256,ESM03ED,Aprendizaje y Desarrollo,Educación,,,10
2257,ESM04ED,Planificación Curricular,Educación,,,9
2258,ESM05ED,Estrategias de Didáctica,Educación,,,9
2259,ESM06ED,Innovación en Educación,Educación,,,7
2260,ESM07ED,Evaluación de los Aprendizajes,Educación,,,7
2261,ESM08ED,Gestión de Aulas Heterogéneas,Educación,,,7
2262,ESM09ED,Liderazgo en el Aula,Educación,,,7
2263,MED103O,Anatomía Topográfica y Embriología I,Escuela De Medicina,,,10
2264,MED107A,Bases y Fundamentos de la Medicina I,Escuela De Medicina,,Aprendizaje Servicio,10
2265,MED109A,Psicología Médica,Escuela De Medicina,,,5
2266,MED206A,Salud Pública,Escuela De Medicina,,Aprendizaje Servicio,5
2267,MED207A,Antropología y Ética,Escuela De Medicina,,,10
2268,MED208A,Inmunología y Genética,Escuela De Medicina,,,5
2269,MED209A,Integrado Ciencias Médicas II,Escuela De Medicina,,,5
2270,MED212A,Morfología II,Escuela De Medicina,,,15
2271,MED3000,Nefrologia Pediatrica Ia,Escuela De Medicina,,,35
2272,MED3002,Nefrologia Pediatrica Iia,Escuela De Medicina,,,35
2273,MED308A,Clínica I,Escuela De Medicina,,,15
2274,MED311A,Integrado Ciencias Médicas IV,Escuela De Medicina,,,5
2275,MED403A,Ética Médica,Escuela De Medicina,,,10
2276,MED404A,Clínicas III,Escuela De Medicina,,,40
2277,MED405A,Integrado Ciencias Médicas VI,Escuela De Medicina,,,5
2278,MED508A,Bases de la Práctica Profesional,Escuela De Medicina,,,10
2279,MED509A,Integrado Ciencias Médicas VIII,Escuela De Medicina,,,5
2280,MED605A,Internado Medicina Familiar,Escuela De Medicina,,Aprendizaje Servicio,20
2281,MED606A,Internado de Urgencias,Escuela De Medicina,,,15
2282,MED607A,Internado de Otorrinolaringología,Escuela De Medicina,,,5
2283,MED608A,Internado de Neuropsiquiatría Clínica,Escuela De Medicina,,,20
2284,MED609A,Internado de Oftalmología,Escuela De Medicina,,,5
2285,MED610A,Internado Electivo,Escuela De Medicina,,,5
2286,MED611A,Internado de Dermatología,Escuela De Medicina,,,5
2287,MED612A,Internado de Profundización,Escuela De Medicina,,,5
2288,MED831,Radiología de Emergencias,Escuela De Medicina,,,5
2289,MED837,Primeros Auxilios Básicos en Lugares Remotos,Escuela De Medicina,Salud y Bienestar,,10
2290,MED841,Anatomía General y del Desarrollo,Escuela De Medicina,,,10
2291,MED845,"Alimentación, Bienestar y Salud",Escuela De Medicina,Salud y Bienestar,,10
2292,MED848,Investigadores Junior en Medicina de Urgencia,Escuela De Medicina,,,5
2293,MED851,Ultrasonido Clínico del Paciente Con Shock Indiferenciado,Escuela De Medicina,,,5
2294,MED852,Abordaje del Dolor Crónico Desde Una Perspectiva Interdisciplinaria,Escuela De Medicina,,,5
2295,MED853,¿Qué Sabemos de Donación de Órganos?,Escuela De Medicina,Salud y Bienestar,,5
2296,MED854,El Desafio Social y Cultural del Cancer,Escuela De Medicina,Salud y Bienestar,,10
2297,MED855,Estrategias Innovadoras en Salud (Innovasalud),Escuela De Medicina,Ciencia y Tecnologia,,10
2298,MED862,Sociedad y Salud en Chile: Entre la Política y la Ciencia.,Escuela De Medicina,Humanidades,,10
2299,MED863,Uc Propone: Investigación Aplicada en Ciencias Sociales,Escuela De Medicina,Ciencias Sociales,,10
2300,EES1020,Currículum y Diversificación de la Enseñanza,Educación,,,10
2301,EES1030,Desarrollo de Conceptos y Habilidades Matemáticas I,Educación,,,10
2302,IEE0020,Investigacion o Proyecto,Ingeniería,,,20
2303,IEE1100,Introducción a la Ingeniería Eléctrica,Ingeniería,,,10
2304,IEE2103,Señales y Sistemas,Ingeniería,,,10
2305,IEE2113,Teoría Electromagnética,Ingeniería,,,10
2306,IEE2123,Circuitos Eléctricos,Ingeniería,,,10
2307,IEE2183,Laboratorio de Mediciones Eléctricas,Ingeniería,,,5
2308,IEE2213,Máquinas Eléctricas,Ingeniería,,,10
2309,IEE2224,Accionamientos Eléctricos,Ingeniería,,,10
2310,IEE2273,Laboratorio de Máquinas Eléctricas,Ingeniería,,,5
2311,IEE2343,Protecciones,Ingeniería,,,10
2312,IEE2393,Redes Inteligentes para Energía Sustentable,Ingeniería,,,10
2313,IEE2413,Electrónica,Ingeniería,,,10
2314,IEE2463,Sistemas Electrónicos Programables,Ingeniería,,,10
2315,IEE2473,Laboratorio de Electrónica Analógica y Digital,Ingeniería,,,5
2316,IEE2513,Comunicaciones,Ingeniería,,,10
2317,IEE2613,Control Automático,Ingeniería,,,10
2318,IEE2683,Laboratorio de Control Automático,Ingeniería,,,5
2319,IEE2713,Sistemas Digitales,Ingeniería,,,10
2320,IEE2714,Fundamentos de Procesamiento de Imágenes,Ingeniería,,,10
2321,IEE2913,Diseño Eléctrico (Capstone),Ingeniería,,,10
2322,IEE2972,Trabajo Personal Dirigido,Ingeniería,,,5
2323,IEE2981,Trabajo Personal Dirigido,Ingeniería,,,5
2324,IEE2985,Investigacion o Proyecto,Ingeniería,,,10
2325,IEE2986,Investigacion o Proyecto,Ingeniería,,,10
2326,IEE2987,Investigacion o Proyecto,Ingeniería,,,10
2327,IEE2988,Investigación o Proyecto (Optativo de Titulación),Ingeniería,,,10
2328,IEE3112,Proyecto Final de Ingenieria Eléctrica (Proyecto de Título),Ingeniería,,,10
2329,IEE3154,Seminario en Ingeniería Eléctrica,Ingeniería,,,10
2330,IEE3234,Movilidad Eléctrica,Ingeniería,,,10
2331,IEE3373,Mercados Eléctricos,Ingeniería,,,10
2332,IEE3610,Sistemas Dinámicos,Ingeniería,,,10
2333,IEE3674,Control Predictivo,Ingeniería,,,10
2334,IEE3724,Reconocimiento de Patrones,Ingeniería,,,10
2335,IEE3732,Procesamiento Digital de Senales,Ingeniería,,,10
2336,IEE3764,Formación de Imágenes,Ingeniería,,,10
2337,IEE3787,Procesamiento Multiescala de Imágenes,Ingeniería,,,10
2338,IEE3864,Fundamentos de Instrumentación Astronómica,Ingeniería,,,10
2339,IEE3893,Radio Astronomía,Ingeniería,,,10
2340,IEE3896,Teoría y Diseño de Antenas,Ingeniería,,,10
2341,EES1000,Introducción a la Educación Especial,Psicología,,,10
2342,EES1040,Neurodesarrollo y Diversidad,Psicología,,,10
2343,EES1050,"Educación de Niñas, Niños y Jóvenes Con Discapacidad Intelectual",Psicología,,,10
2344,EES1060,"Educación de Niñas, Niños y Jóvenes Sordos e Hipoacúsicos",Psicología,,,10
2345,EFS1000,Juego y Vida Activa,Educación,,Aprendizaje Servicio,10
2346,EFS1010,Fundamentos de la Motricidad Humana y la Educación Física,Educación,,Aprendizaje Servicio,10
2347,EFS1030,Expresión Corporal y Folclore,Educación,,Aprendizaje Servicio,10
2348,EFS1041,Entrenamiento Deportivo Escolar II,Educación,,,10
2349,EFS1060,Nutrición y Alimentación para la Salud y Actividad Física,Educación,,Aprendizaje Servicio,10
2350,EFS1500,Atletismo,Educación,,,5
2351,EFS1505,Fútbol/Balonmano,Educación,,,5
2352,EFS1510,Natación/Gimnasia,Educación,,Aprendizaje Servicio,5
2353,EFS1520,Deportes Individuales: Tenis,Educación,,,5
2354,EFS1525,Deportes Colectivos: Hockey Césped,Educación,,,5
2355,EFS1535,Deportes Colectivos: Rugby,Educación,,,5
2356,EFS1540,Deportes Individuales: Entrenamiento Funcional,Educación,,,5
2357,MEF102A,Anatomía General y del Desarrollo,Escuela De Medicina,,,10
2358,MEF103A,Bioestadística,Escuela De Medicina,,,10
2359,MEF205A,Bioestadística,Escuela De Medicina,,,5
2360,IEG3100,Analisis Estructural Lineal,Ingeniería,,,5
2361,IEG3110,Elementos Finitos Lineales,Ingeniería,,,5
2362,IEG3200,Diseno Avanzado en Hormigon Armado,Ingeniería,,,5
2363,IEG3220,Diseño de Estructuras Pretensadas,Ingeniería,,,5
2364,IEG3280,Diseño de Estructuras Industriales de Acero,Ingeniería,,,5
2365,IEG3300,Dinámica Estructural,Ingeniería,,,5
2366,IEG3500,Análisis Sísmico,Ingeniería,,,5
2367,IEG3510,Diseño Sismorresistente Avanzado,Ingeniería,,,5
2368,IEG3520,Aislamiento Sísmico,Ingeniería,,,5
2369,IEG3660,Ingeniería Geotécnica Sísmica,Ingeniería,,,5
2370,IEG3700,Métodos Analíticos en Ingeniería Civil,Ingeniería,,,5
2371,IEG3710,Métodos Numéricos en Ingeniería Civil,Ingeniería,,,5
2372,IEG4010,Seminario de Ingenieria Estructural y Geotecnica I,Ingeniería,,,5
2373,IEG4020,Seminario de Ingenieria Estructural y Geotecnica II,Ingeniería,,,5
2374,IEG4970,Actividad de Graduacion,Ingeniería,,,30
2375,IEG4971,Seminario de Graduación I,Ingeniería,,,5
2376,MEH3000,Hemostasia y Trombosis I,Escuela De Medicina,,,46
2377,MEH3002,Hemostasia y Trombosis II,Escuela De Medicina,,,46
2378,EIN1001,Introduction to Teaching English (Cpc),Educación,,,10
2379,EIN1002,Language and Culture I (Cpc),Educación,,,10
2380,EIN1004,Language and Culture III (Cpc),Educación,,,10
2381,EIN1007,English Spanish Contrasts (Cpc),Educación,,,10
2382,EIN1008,Literature for Children (Cpc),Educación,,,10
2383,EIN1010,Seminar,Educación,,,10
2384,MEI1000,Enfermedades Infecciosas del Adulto Ia,Escuela De Medicina,,,35
2385,MEI1020,Enfermedades Infecciosas del Adulto Iia,Escuela De Medicina,,,35
2386,MEK102,Fundamentos Psicológicos para Kinesiología,Escuela De Medicina,,,5
2387,MEK204C,Farmacología para Kinesiología,Escuela De Medicina,,,5
2388,EMS3000,Proyecto de Graduación,Economía Y Administración,,,20
2389,MEM3001,Educación Médica Basada en Evidencia,Escuela De Medicina,,,10
2390,MEM3002,Bases del Aprendizaje y Metodologías Docentes para la Educación de las Profesiones de la Salud,Escuela De Medicina,,,10
2391,MEM3003,Enseñanza Clínica para la Educación de las Profesiones de la Salud,Escuela De Medicina,,,10
2392,MEM3006,Antropología y Ética en la Educación Médica,Escuela De Medicina,,,10
2393,MEM3007,Gestión de Proyectos Educacionales para las Carreras de la Salud,Escuela De Medicina,,,10
2394,MEM3013,Investigación en Educación Médica,Escuela De Medicina,,,10
2395,MEM3014,Habilidades en Desarrollo Curricular y Evaluación de Aprendizajes y Programas en Educación Medica,Escuela De Medicina,,,10
2396,MEM3015,Habilidades en Metodología Docente en Educación Médica,Escuela De Medicina,,,10
2397,MEM3032,Patología de Paciente Crítico,Escuela De Medicina,,,10
2398,EMA3000,Fundamentos de la Ética,Instituto De Éticas Aplicadas,,,10
2399,EMA3001,Laboratorio en Ética Aplicada,Instituto De Éticas Aplicadas,,,5
2400,EMA3002,Ética de las Profesiones,Instituto De Éticas Aplicadas,,,5
2401,REN101,Desafíos de la Ingeniería de Recursos Naturales,Agronomía Y Sistemas Naturales,,,5
2402,REN203,Geología y Ciencias del Suelo,Agronomía Y Sistemas Naturales,,,10
2403,REN225,Metodologías de Investigación,Agronomía Y Sistemas Naturales,,,10
2404,ENA3520,Fundamentos para los Cuidados Especializados de Enfermería en Cuidados Críticos del Adulto,Escuela De Enfermería,,,10
2405,ENA3521,Especialidad de Enfermería en Cuidados Críticos del Adulto I,Escuela De Enfermería,,,25
2406,END3020,Fundamentos para el Cuidado Especialista de Enfermería en Personas Con Problemas Cardiacos,Escuela De Enfermería,,,10
2407,END3120,Enfermería para Cuidados Especialistas en Personas Con Problemas Cardiacos I,Escuela De Enfermería,,,25
2408,ENE3010,Cuidados Avanzados de Enfermeria del Adulto Con Problemas Renales I,Escuela De Enfermería,,,30
2409,ENF1100,Sueño: ¿Cómo Mantener y Mejorar Esta Necesidad Vital?,Escuela De Enfermería,Salud y Bienestar,,10
2410,ENF1112,Naturaleza de la Enfermería,Escuela De Enfermería,,,5
2411,ENF1124,Psicología,Escuela De Enfermería,,,10
2412,ENF1126,Salud Intercultural,Escuela De Enfermería,Salud y Bienestar,,10
2413,ENF1127,"Salud, Cultura y Sociedad Global",Escuela De Enfermería,,,10
2414,ENF1133,Metodología de la Investigación,Escuela De Enfermería,,,5
2415,ENF1205,Cuidados de Enfermería I,Escuela De Enfermería,,,10
2416,ENF1212,Salud Pública,Escuela De Enfermería,,,10
2417,ENF2112,Cuidados de Enfermería de la Persona y Familia,Escuela De Enfermería,,,15
2418,ENF2115,Educación para la Salud,Escuela De Enfermería,,,5
2419,ENF2208,Cuidados de Enfermería II,Escuela De Enfermería,,,15
2420,ENF2215,Informática en Salud I,Escuela De Enfermería,,,5
2421,ENF2220,Gestión y Liderazgo I,Escuela De Enfermería,,,5
2422,ENF2302,Cuidados de Enfermería de la Mujer y Recién Nacido,Escuela De Enfermería,,,30
2423,ENF2305,Dimensión Interpersonal del Cuidado de Enfermería,Escuela De Enfermería,,,10
2424,ENF2310,Cuidados de Enfermería en la Infancia y Adolescencia,Escuela De Enfermería,,,30
2425,ENF2315,Cuidados de Enfermería del Adulto y Persona Mayor,Escuela De Enfermería,,,20
2426,ENF2318,Cuidados de Enfermaría del Adulto y Adulto Mayor,Escuela De Enfermería,,,30
2427,ENF2322,Fundamentos Éticos del Ejercicio Profesional,Escuela De Enfermería,,,10
2428,ENF2325,Cuidados de Enfermería en la Infancia y Adolescencia,Escuela De Enfermería,,,20
2429,ENF2400,Gestión de Enfermería en Servicios Clínicos,Escuela De Enfermería,,,10
2430,ENF2408,Investigación,Escuela De Enfermería,,,10
2431,ENF2410,Enfermería en Salud Familiar y Comunitaria,Escuela De Enfermería,,,20
2432,ENF2412,Seminario Profesional,Escuela De Enfermería,,,5
2433,ENF2416,Cuidados de Enfermería en Salud Mental,Escuela De Enfermería,,,10
2434,ENF2420,Cuidados de Enfermería en Personas Con Condiciones Crónicas de Salud,Escuela De Enfermería,,,20
2435,ENF2425,Gestión y Liderazgo II,Escuela De Enfermería,,,10
2436,ENF2428,Informática en Salud II,Escuela De Enfermería,,,5
2437,ENF2500,Cuidados de Enfermería en la Mujer Con Problemas de Salud Gíneco-Obstétricos,Escuela De Enfermería,,,20
2438,ENF2504,Internado Ambulatorio en Salud de la Mujer,Escuela De Enfermería,,,25
2439,ENF2508,Internado Hospitalario en Salud de la Mujer,Escuela De Enfermería,,,25
2440,ENF2512,Internado de Enfermería Hospitalario,Escuela De Enfermería,,,25
2441,ENF2516,Internado de Enfermería  Ambulatorio,Escuela De Enfermería,,Aprendizaje Servicio,25
2442,ENF2520,Cuidados de Enfermería del Adulto en el Intra y Postoperatorio,Escuela De Enfermería,,,20
2443,ENF2524,Cuidados de Enfermería del Adulto Enfermo Crìtico,Escuela De Enfermería,,,20
2444,ENF2528,Enfermería en Urgencias,Escuela De Enfermería,,,10
2445,ENF2532,La Salud del Adulto Mayor,Escuela De Enfermería,,,20
2446,ENF2536,Enfermería en Salud Familiar,Escuela De Enfermería,,,20
2447,ENF2540,Cuidados de Enfermería del Niño Enfermo,Escuela De Enfermería,,,20
2448,ENF2544,Cuidados de Enfermería del Recién Nacido,Escuela De Enfermería,,,20
2449,ENF2548,Intervención de Enfermería en Salud Comunitaria,Escuela De Enfermería,,,20
2450,ENF2552,Enfermería en Salud Mental y Psiquiatría II,Escuela De Enfermería,,,20
2451,ENF2556,Enfermería en Salud Mental y Psiquiatría III,Escuela De Enfermería,,,20
2452,ENF300P,Promoción y Protección de la Salud en la Infancia,Escuela De Enfermería,,,5
2453,ENF4000,Debates Actuales en Teorias en Enfermeria,Escuela De Enfermería,,,10
2454,ENF4030,"Etica, Legislación y Salud",Escuela De Enfermería,,,10
2455,ENF4101,Metodología de Investigación Cuantitativa Avanzada,Escuela De Enfermería,,,10
2456,ENF4130,Proyecto de Tesis,Escuela De Enfermería,,,10
2457,ENF4140,Tesis,Escuela De Enfermería,,,40
2458,ENF425,Autocuidado de la Salud,Escuela De Enfermería,,,10
2459,ENF4310,Practica Avanzada de Enfermeria Basada en Evidencias,Escuela De Enfermería,,,10
2460,ENF4340,Fisiopatología Avanzada,Escuela De Enfermería,,,10
2461,ENF4360,Farmacología Clínica en Enfermería de Práctica Avanzada,Escuela De Enfermería,,,10
2462,ENF4370,Práctica Avanzada de Enfermería Basada en Evidencias,Escuela De Enfermería,,,10
2463,ENF4390,Rol de la Enfermería de Práctica Avanzada,Escuela De Enfermería,,,5
2464,ENF4410,Enfermería de Práctica Avanzada en Cuidados de Personas Con Cáncer II,Escuela De Enfermería,,,15
2465,ENF4430,Proyecto de Intervención de Enfermería de Práctica Avanzada,Escuela De Enfermería,,,20
2466,ENF4500,Enfermería de Práctica Avanzada en Cuidados de Personas Con Cuidados Paliativos I,Escuela De Enfermería,,,10
2467,ENF4510,Enfermería de Práctica Avanzada en Cuidados de Personas Con Cuidados Paliativos II,Escuela De Enfermería,,,15
2468,ENF4520,Residencia Clínica en Cuidados Paliativos,Escuela De Enfermería,,,15
2469,ENH3010,Cuidados Avanzados de Enfermería del Adulto Mayor,Escuela De Enfermería,,,30
2470,ENJ3020,Fundamentos del Cuidado Especialista de Enfermería del Niño y Adolescente Con Problemas Oncológicos,Escuela De Enfermería,,,10
2471,ENJ3120,Cuidados Especializados de Enfermería en Niños y Adolescentes Con Problemas Oncológicos I,Escuela De Enfermería,,,25
2472,ENL3010,Cuidados de Enfermeria del Recien Nacido de Alto Riesgo I,Escuela De Enfermería,,,30
2473,ENN3020,Fundamentos de Enfermería para Cuidados Críticos Especializados en la Infancia,Escuela De Enfermería,,,10
2474,ENN3120,Especialidad de Enfermería en Cuidados Críticos del Niño y Adolescente I,Escuela De Enfermería,,,25
2475,ENO2007,Cuidados Paliativos,Escuela De Enfermería,,,10
2476,ENO2022,Equidad de Género y Salud: Retos para la Acción,Escuela De Enfermería,Salud y Bienestar,,10
2477,ENO2027,Introducción y Manejo de los Accesos Vasculares en Enfermería,Escuela De Enfermería,,,5
2478,ENO2028,Uc Propone: Investigación Aplicada en Ciencias Sociales,Escuela De Enfermería,Ciencias Sociales,,10
2479,ENO3102,Estudio Independiente,Escuela De Enfermería,,,10
2480,ENO4124,Salud Planetaria y Transdisciplina: Enfrentando los Retos del Siglo Xxi,Escuela De Enfermería,,,10
2481,ENO4125,Violencia de Género: Enfoques Teóricos y Prácticos,Escuela De Enfermería,,,10
2482,ENO4130,Investigacion Fenomenologica en Salud,Escuela De Enfermería,,,10
2483,ENO4200,Herramientas de Gestión Estratégica en la Dirección de Servicios de Enfermería,Escuela De Enfermería,,,10
2484,MEN1000,Endocrinologia Ia,Escuela De Medicina,,,35
2485,MEN1020,Endocrinologia Iia,Escuela De Medicina,,,35
2486,MEN102A,Morfología Humana,Escuela De Medicina,,,10
2487,MEN207A,Fisiopatología General,Escuela De Medicina,,,10
2488,MEN402A,Gestión en Organizaciones de Salud,Escuela De Medicina,,,5
2489,IEN3110,Energia Hidraulica,Ingeniería,,,5
2490,IEN3120,Energia y Desarrollo Sustentable,Ingeniería,,,5
2491,IEN3140,Tecnologías para Generación Eléctrica,Ingeniería,,,5
2492,IEN3210,Economia Energetica y Ambiental,Ingeniería,,,5
2493,IEN3220,Planificacion y Politica Energetica,Ingeniería,,,5
2494,IEN3240,Mercados Energéticos,Ingeniería,,,5
2495,IEN3310,Energia Renovable,Ingeniería,,,5
2496,IEN3510,Evaluacion de Proyectos Energeticos,Ingeniería,,,5
2497,IEN3520,Construccion Sustentable,Ingeniería,,,5
2498,IEN3540,Ciclo de Combustible Nuclear,Ingeniería,,,5
2499,IEN3550,Seguridad de Sistemas de Energía,Ingeniería,,,5
2500,IEN3610,Innovacion y Gestion de la Tecnologia,Ingeniería,,,5
2501,IEN3620,Produccion y Usos del Hidrogeno,Ingeniería,,,5
2502,IEN3630,Tecnologias de Energia Renovable,Ingeniería,,,5
2503,IEN3650,Almacenamiento de Energía,Ingeniería,,,5
2504,IEN3660,Análisis de Reactores Nucleares,Ingeniería,,,5
2505,IEN3820,Diseno de Sistemas de Energia Renovable,Ingeniería,,,5
2506,IEN3840,Diseno de Sistemas Nucleares,Ingeniería,,,5
2507,IEN3910,Energía Solar,Ingeniería,,,5
2508,IEN3920,Análisis de Datos Energéticos,Ingeniería,,,5
2509,IEN4970,Actividad de Graduacion I,Ingeniería,,,30
2510,IEN4971,Seminario de Graduación I,Ingeniería,,,5
2511,IEN4972,Seminario de Graduación II,Ingeniería,,,5
2512,GEO103,Geografía Humana General,Geografía,,,10
2513,GEO104,Geografía Física General,Geografía,,,10
2514,GEO109,Geografía Matemática y Cartografía,Geografía,,,10
2515,GEO110,Desafíos de la Geografía,Geografía,,,5
2516,GEO111,Geografía de Chile: Espacio y Sociedad,Geografía,,,10
2517,GEO112,Geografía Cultural,Geografía,,,10
2518,GEO201,Climatología,Geografía,,,10
2519,GEO202,Sistemas de Información Geográfica,Geografía,,,10
2520,GEO203,Terreno I,Geografía,,,5
2521,GEO302,Geografía Rural,Geografía,,,10
2522,GEO303,Geomorfología Dinámica y Climática,Geografía,,,10
2523,GEO304,Edafogeografía,Geografía,,,10
2524,GEO305,Terreno II,Geografía,,,5
2525,GEO3084,Aplicaciones de Geomatica,Geografía,,,10
2526,GEO400,Poder y Territorio,Geografía,,,10
2527,GEO401,Seminario de Investigación I,Geografía,,,15
2528,GEO402,Hidrología,Geografía,,,10
2529,GEO500,"Desarrollo Urbano: Teoría, Modelos y Gestión",Geografía,,,10
2530,GEO501,Gestión Integrada del Litoral,Geografía,,,10
2531,GEO502,Evaluación de Proyectos Territoriales,Geografía,,,10
2532,GEO5020,Métodos Estadísticos para Estudios Espaciales y Ambientales,Geografía,,,10
2533,GEO5021,Fundamentos Geográficos del Sistema Natural,Geografía,,,10
2534,GEO5024,Teoría y Análisis de la Organización del Espacio,Geografía,,,10
2535,GEO5025,Percepción Remota e Imágenes Satelitales,Geografía,,,10
2536,GEO5026,Taller de Casos de Estudio y Aplicaciones,Geografía,,,20
2537,GEO5028,Taller de Tesis,Geografía,,,20
2538,GEO503,Gestión y Administración Territorial,Geografía,,,5
2539,GEO5049,Introducción a los Sistemas de Información Geográfica,Geografía,,,10
2540,GEO5050,Análisis Geográfico de la Minería,Geografía,,,10
2541,GEO5059,Introducción a la Ciencia de Datos Con R,Geografía,,,10
2542,GEO507,Práctica Profesional,Geografía,,,0
2543,GEO5113,Seminario de Investigación I,Geografía,,,15
2544,GEO5115,Seminario de Investigación III,Geografía,,,15
2545,GEO5118,Tesis Doctoral I,Geografía,,,50
2546,GEO5120,Tesis III,Geografía,,,50
2547,GEO5121,Tesis IV,Geografía,,,50
2548,GEO5122,Teoría y Métodos en Geografía,Geografía,,,10
2549,GEO5123,Etica e Investigación Geográfica,Geografía,,,10
2550,GEO5126,Apoyo Docencia,Geografía,,,0
2551,GEO5129,Autoría Artículo Científico o Patente,Geografía,,,0
2552,GEO5130,Pasantía en el Extranjero,Geografía,,,0
2553,GEO5146,Tópicos Avanzados en Geografía,Geografía,,,5
2554,GEO5150,Evaluación Ambiental Estratégica:Aplicaciones y Contribuciones para la Sustentabilidad,Geografía,,,10
2555,GEO609,Educación Ambiental para el Desarrollo Sustentable,Geografía,,Aprendizaje Servicio,10
2556,GEO612,"El Desierto de Atacama: Su Pasado, Presente y Futuro de Un Espacio Estratégico",Geografía,,,10
2557,GEO620,Asia y América Latina,Geografía,Ciencias Sociales,,10
2558,GEO621,¡Los Desastres No Son Naturales!,Geografía,Ciencias Sociales,,10
2559,GEO623,"Patrimonio, Territorio y Turismo: Una Relación de Contrastes",Geografía,Ecolog Integra y Sustentabilid,,10
2560,GEO624,Empoderamiento Climático,Geografía,Ecolog Integra y Sustentabilid,,10
2561,GEO625,Introducción a la Geografía Física General,Geografía,,,10
2562,GEO628,Turismo Alternativo: Una Mirada Desde los Territorios,Geografía,Ecolog Integra y Sustentabilid,,10
2563,TEO231,Síntesis B,Teología,,,10
2564,TEO235,Hebreo Biblico,Teología,,,5
2565,TEO281,Profundización en el Antiguo Testamento B (Primer Testamento),Teología,,,10
2566,TEO283,Profundización en el Nuevo Testamento B (Segundo Testamento),Teología,,,10
2567,TEO289,Cuestiones de Ciencias de la Religión,Teología,,,10
2568,TEO292,Cuestiones de Trinidad y Cristología,Teología,,,10
2569,TEO3001,Curso Especialidad I,Teología,,,16
2570,TEO3002,Curso Especialidad II,Teología,,,16
2571,TEO3003,Curso Especialidad III,Teología,,,16
2572,TEO3004,Proyecto de Tesis I,Teología,,,40
2573,TEO3005,Proyecto de Tesis II,Teología,,,40
2574,TEO3006,Examen de Candidatura,Teología,,,20
2575,TEO3007,Seminario Doctoral I,Teología,,,20
2576,TEO3008,Seminario Doctoral II,Teología,,,20
2577,TEO3009,Actividad Anual de Seguimiento I,Teología,,,0
2578,TEO300T,Tesis de Magister,Teología,,,45
2579,TEO3010,Actividad Anual de Seguimiento II,Teología,,,0
2580,TEO3011,Pasantía Internacional,Teología,,,0
2581,TEO3012,Trabajo Doctoral I,Teología,,,30
2582,TEO3013,Trabajo Doctoral II,Teología,,,30
2583,TEO3014,Trabajo Doctoral III,Teología,,,50
2584,TEO3015,Trabajo Doctoral IV,Teología,,,50
2585,TEO3016,Trabajo Doctoral V,Teología,,,50
2586,TEO3017,Trabajo Doctoral VI,Teología,,,50
2587,TEO3018,Coloquio Doctoral I,Teología,,,0
2588,TEO3019,Coloquio Doctoral II,Teología,,,0
2589,TEO3020,Coloquio Doctoral III,Teología,,,0
2590,TEO3021,Coloquio Doctoral IV,Teología,,,0
