,sigla,name,school,area,category,credits
2996,FIL023,Historia de la Filosofía Moderna,Filosofía,,,10
2997,FIL026,Introducción a la Filosofía,Filosofía,,,10
2998,FIL027,Teoría del Conocimiento,Filosofía,,,10
2999,FIL109T,Introducción a la Filosofía,Filosofía,,,10
3000,FIL111T,Logica,Filosofía,,,10
3001,FIL112T,Teoria del Conocimiento,Filosofía,,,10
3002,FIL115T,Filosofia Social,Filosofía,,,10
3003,FIL119T,Historia de la Filosofia Antigua,Filosofía,,,10
3004,FIL122T,Historia de la Filosofia Moderna,Filosofía,,,10
3005,FIL143,Filosofia de las Ciencias,Filosofía,,,10
3006,FIL166,Tesis de Grado,Filosofía,,,20
3007,FIL167,Seminario de Filosofía Optativo a,Filosofía,,,10
3008,FIL175,Seminario de Grado I,Filosofía,,,10
3009,FIL185P,Ética para Psicología,Filosofía,,,10
3010,FIL2000,Ética Aplicada a Inteligencia Artificial,Filosofía,,,5
3011,FIL2001,Filosofía: ¿Para Qué?,Filosofía,Formacion Filosofica,,10
3012,FIL2002,Ética: ¿Cómo Deberíamos Vivir?,Filosofía,Humanidades,,10
3013,FIL2003,"Verdad, Bien y Belleza",Filosofía,Humanidades,,10
3014,FIL2005,De Homero a Facebook: Filosofía de la Tecnología,Filosofía,Humanidades,,10
3015,FIL2006,Introducción a la Argumentación,Filosofía,Humanidades,,10
3016,FIL2008,Uc Propone: Investigación Aplicada en Ciencias Sociales,Filosofía,Ciencias Sociales,,10
3017,FIL213T,Filosofia de la Religion,Filosofía,,,10
3018,FIL214,Fundamentos Filosóficos de la Psicología,Filosofía,,,10
3019,FIL4456,Filosofia del Conocimiento,Filosofía,,,10
3020,FIL7002,Seminario Filosofía I,Filosofía,,,20
3021,FIL7003,Seminario Filosofía II,Filosofía,,,20
3022,FIL7011,Grupo de Investigación I,Filosofía,,,5
3023,FIL7013,Grupo de Investigación III,Filosofía,,,5
3024,FIL9201,Curso Tutorial,Filosofía,,,15
3025,FIL9220,Examen de Candidatura Doctoral,Filosofía,,,0
3026,FIL9230,Actividad Anual de Seguimiento I,Filosofía,,,0
3027,FIL9231,Actividad Anual de Seguimiento II,Filosofía,,,0
3028,FIL9240,Autoría Artículo Científico o Patente,Filosofía,,,0
3029,FIL9241,Pasantía,Filosofía,,,0
3030,FIL9300,Proyecto de Tesis,Filosofía,,,30
3031,FIL9311,Monografía de Magíster,Filosofía,,,15
3032,FIL9410,Tesis II,Filosofía,,,50
3033,FIL9430,Tesis IV,Filosofía,,,50
3034,FIL9930,Pensamiento Oriental,Filosofía,,,10
3035,FIM3031,Electrónica para Físicos II,Física,,,15
3036,FIM3110,Introducción a Teorías de Gauge,Física,,,15
3037,FIM3120,Teoría Cuántica de Campos II,Física,,,15
3038,FIM3405,Física del Sólido Avanzada,Física,,,15
3039,FIM3430,Mecánica Clásica Avanzada,Física,,,15
3040,FIM3435,Introducción a la Teoría Espectral en Mecánica Cuántica,Física,,,15
3041,FIM4008,Técnicas de Caracterización de Materiales,Física,,,15
3042,FIM4141,Finanzas Cuantitativas para Físicos,Física,,,15
3043,FIM8203,Actividad Anual de Seguimiento I,Física,,,0
3044,FIM8204,Actividad Anual de Seguimiento II,Física,,,0
3045,FIM8300,Autoría Artículo Científico o Patente,Física,,,0
3046,FIM8351,Óptica Moderna y Fotónica,Física,,,15
3047,FIM8440,Mecánica Cuántica Avanzada I,Física,,,15
3048,FIM8605,Tesis Doctorado V,Física,,,50
3049,FIM8606,Tesis Doctorado VI,Física,,,50
3050,FIM8610,Exámen de Candidatura,Física,,,40
3051,FIM8611,Tesis de Doctorado I,Física,,,40
3052,FIM8612,Tesis de Doctorado II,Física,,,40
3053,FIM8613,Tesis de Doctorado III,Física,,,40
3054,FIM8614,Tesis de Doctorado IV,Física,,,40
3055,FIM8771,Tesis de Magíster I,Física,,,20
3056,FIM8772,Tesis de Magíster II,Física,,,30
3057,FIM8781,Tesis de Magíster I,Física,,,20
3058,FIS0103,Física y Tecnología para Líderes de Opinión,Física,Ciencia y Tecnologia,,10
3059,FIS0109,Laboratorio de Física para Ciencias,Física,,,0
3060,FIS0152,Laboratorio de Termodinámica,Física,,,0
3061,FIS0153,Laboratorio de Electricidad y Magnetismo,Física,,,0
3062,FIS0154,Laboratorio de Dinámica,Física,,,0
3063,FIS1032,Fisica General,Física,,,10
3064,FIS109C,Fisica para Ciencias,Física,,,10
3065,FIS109K,Física,Física,,,10
3066,FIS119E,Física General para Educación Básica,Física,,,10
3067,FIS119L,Laborario de Física,Física,,,0
3068,FIS119M,Física,Física,,,10
3069,FIS119V,Física para Ciencias Biomédicas,Física,,,10
3070,FIS122F,Física Acústica,Física,,,10
3071,MFA1000,Medicina Familiar Adulto Ia,Escuela De Medicina,,,25
3072,MFA1020,Medicina Familiar Adulto Iia,Escuela De Medicina,,,25
3073,MFA1040,Medicina Familiar Adulto Iiia,Escuela De Medicina,,,25
3074,FIS1503,Física General,Física,,,10
3075,FIS1510,Fisica I,Física,,,10
3076,FIS1514,Dinámica,Física,,,10
3077,FIS1523,Termodinámica,Física,,,10
3078,FIS1525,Física II,Física,,,10
3079,FIS1533,Electricidad y Magnetismo,Física,,,10
3080,FIS154D,Dinámica de Partículas,Física,,,10
3081,FIS510L,Laboratorio de Física I,Física,,,0
3082,FIS525L,Laboratorio de Física II,Física,,,0
3083,FIZ0112,Introducción a la Física,Física,,,10
3084,FIZ0121,Mecanica Clasica I,Física,,,10
3085,FIZ0123,Mecánica Clásica I,Física,,,10
3086,FIZ020C,Fisica II,Física,,,10
3087,FIZ020L,Laboratorio de Física II,Física,,,0
3088,FIZ0211,Termodinámica y Teoría Cinética,Física,,,10
3089,FIZ0212,Termodinámica y Teoría Cinética,Física,,,10
3090,FIZ0221,Electricidad y Magnetismo,Física,,,10
3091,FIZ0222,Mecanica Clasica II,Física,,,10
3092,FIZ0224,Electricidad y Magnetismo,Física,,,10
3093,FIZ0311,Fisica Moderna,Física,,,10
3094,FIZ0312,Ondas y Optica,Física,,,10
3095,FIZ0313,Métodos de la Física Matemática II,Física,,,10
3096,FIZ0314,Física Moderna,Física,,,10
3097,FIZ0315,Ondas y Óptica,Física,,,10
3098,FIZ0322,Fisica Cuantica I,Física,,,10
3099,FIZ0411,Mecanica Estadistica,Física,,,10
3100,FIZ0412,Fisica Cuantica II,Física,,,10
3101,FIZ0511,Practica de Licenciatura,Física,,,40
3102,FIZ0614,Física Experimental Avanzada,Física,,,10
3103,FIZ121,Mecánica Clásica I,Física,,,10
3104,FIZ121L,Laboratorio de Mecánica Clásica I,Física,,,0
3105,FIZ1310,Introducción a la Física Médica,Física,,,10
3106,FIZ1404,Fisica No Lineal,Física,,,10
3107,FIZ1412,Métodos Experimentales de Física de Materia Condensada y de Materiales,Física,,,10
3108,FIZ1436,Acustica Lineal General,Física,,,10
3109,FIZ2000,Tecnicas Experimentales Avanzadas,Física,,,10
3110,FIZ210,Termodinámica y Teoría Cinética,Física,,,10
3111,FIZ211L,Laboratorio de Termodinámica y Teoría Cinética,Física,,,0
3112,FIZ2123,Mécanica Clásica I,Física,,,10
3113,FIZ2212,Termodinámica y Teoría Cinética,Física,,,10
3114,FIZ221L,Laboratorio de Electricidad y Magnetismo,Física,,,0
3115,FIZ2314,Física Moderna,Física,,,10
3116,FIZ2700,Fisica del Plasma,Física,,,12
3117,FIZ311L,Laboratorio de Física Moderna,Física,,,0
3118,FIZ312L,Laboratorio de Ondas y Óptica,Física,,,0
3119,FIZ3400,Fisica de Particulas,Física,,,12
3120,IFI1001,Introducción a la Ingeniería Física,Ingeniería,,,10
3121,FMD3002,Física de las Radiaciones y Dosimetría,Física,,,10
3122,FMD3003,Radiobiología y Radioprotección,Física,,,10
3123,FMD3006,Práctica Clínica,Física,,,10
3124,FMD3007,Seminario,Física,,,10
3125,FMD3020,Técnicas Monte Carlo en Radioterapia,Física,,,10
3126,FMD3021,Tesis de Magíster I,Física,,,20
3127,MFN1000,Medicina Familiar Nino Ia,Escuela De Medicina,,,25
3128,MFN1020,Medicina Familiar Nino Iia,Escuela De Medicina,,,25
3129,MFN1040,Medicina Familiar Nino Iiia,Escuela De Medicina,,,25
3130,FON101A,Introducción a la Fonoaudiología,Escuela Ciencias De La Salud,,Aprendizaje Servicio,5
3131,FON103,Inclusión y Discapacidad: el Valor de la Diversidad,Escuela Ciencias De La Salud,Salud y Bienestar,,10
3132,FON104,Fundamentos Básicos de Cultura Sorda y Lengua de Señas Chilena,Escuela Ciencias De La Salud,Salud y Bienestar,,10
3133,FON105,Educación Vocal para la Comunicación Efectiva y Prevención de la Disfonía Ocupacional,Escuela Ciencias De La Salud,Salud y Bienestar,,10
3134,FON106A,Fonoaudiología y Acción Comunitaria: Experiencias Aplicadas,Escuela Ciencias De La Salud,,Aprendizaje Servicio,5
3135,FON206A,Curso de Vida y Desarrollo Humano,Escuela Ciencias De La Salud,,,10
3136,FON301,Evaluación Audiológica,Escuela Ciencias De La Salud,,,10
3137,FON301A,Evaluación Audiológica Objetiva y Otoneurología,Escuela Ciencias De La Salud,,,10
3138,FON302,Patología Fonoaudiológica,Escuela Ciencias De La Salud,,,10
3139,FON303A,Eufonía,Escuela Ciencias De La Salud,,,5
3140,FON312A,Fonoaudiología en Educación,Escuela Ciencias De La Salud,,,10
3141,FON314A,Promoción en Salud,Escuela Ciencias De La Salud,,,5
3142,FON315A,Motricidad Orofacial,Escuela Ciencias De La Salud,,,10
3143,FON401,Evaluación y Procedimientos en Voz,Escuela Ciencias De La Salud,,,5
3144,FON402,Trastornos de la Deglución,Escuela Ciencias De La Salud,,,5
3145,FON403,Evaluación de la Comunicación en Adultos,Escuela Ciencias De La Salud,,,10
3146,FON406,Intervención en la Comunicación de Niños y Adolescentes,Escuela Ciencias De La Salud,,,10
3147,FON408,Neurociencia Cognitiva,Escuela Ciencias De La Salud,,,5
3148,FON411,Recursos Musicales para Fonoaudiología,Escuela Ciencias De La Salud,,,5
3149,FON501,Internado: Educación,Escuela Ciencias De La Salud,,,17
3150,FON502,Internado: Clinico Adultos,Escuela Ciencias De La Salud,,,17
3151,FON503,Internado: Clinico Pediátrico,Escuela Ciencias De La Salud,,,17
3152,FON504,Internado: Voz,Escuela Ciencias De La Salud,,,17
3153,FON506,Internado: Audición,Escuela Ciencias De La Salud,,,17
3154,FON507,Internado Electivo,Escuela Ciencias De La Salud,,,15
3155,MGC1000,Genética Clínica Ia,Escuela De Medicina,,,70
3156,MGC1010,Genética Clínica Iia,Escuela De Medicina,,,70
3157,MGC1020,Genética Clínica Iiia,Escuela De Medicina,,,70
3158,MGO3000,Ginecología Oncológica Ia,Escuela De Medicina,,,35
3159,MGO3002,Ginecología Oncológica Iia,Escuela De Medicina,,,35
3160,MGP3001,Gastroenterología y Nutricion Pediátrica I a,Escuela De Medicina,,,35
3161,MGP3020,Gastroenterología y Nutrición Pediátrica II a,Escuela De Medicina,,,35
3162,MGR1000,Geriatria Ia,Escuela De Medicina,,,35
3163,MGR1010,Geriatria Iia,Escuela De Medicina,,,35
3164,MGT1000,Gastroenterologia Ia,Escuela De Medicina,,,35
3165,MGT1020,Gastroenterologia Iia,Escuela De Medicina,,,35
3166,MSG3000,Fundamentos de Salud Pública Global,Escuela De Medicina,,,5
3167,MSG3001,Bases Epidemiológicas de la Salud Pública Global,Escuela De Medicina,,,5
3168,MSG3002,Bioestadística en Salud Pública,Escuela De Medicina,,,5
3169,MSG3003,Salud Global,Escuela De Medicina,,,5
3170,MSG3006,Ética y Salud Pública,Escuela De Medicina,,,5
3171,MSG3007,Salud Ambiental: Desafíos Locales y Globales,Escuela De Medicina,,,5
3172,MSG3008,Ciencias Sociales y del Comportamiento en Salud,Escuela De Medicina,,,5
3173,MSG3009,Salud y Trabajo en Un Mundo Global,Escuela De Medicina,,,5
3174,MSG3010,Actividad Final de Grado,Escuela De Medicina,,,20
3175,IIC100G,En Búsqueda del Bienestar: ¿Qué Nos Dice la Ciencia?,Ingeniería,Salud y Bienestar,,10
3176,ING0600,Trabajo Personal Dirigido,Ingeniería,,,5
3177,ING0601,Trabajo Personal Dirigido,Ingeniería,,,5
3178,ING0700,Investigación o Proyecto,Ingeniería,,,10
3179,ING0701,Investigación o Proyecto,Ingeniería,,,10
3180,ING0800,Investigación o Proyecto,Ingeniería,,,20
3181,ING0901,Pasantía de Investigación Nacional,Ingeniería,,,10
3182,ING0902,Pasantía de Investigación en el Extranjero,Ingeniería,,,10
3183,ING0903,Pasantía de Investigación en Empresa,Ingeniería,,,10
3184,ING0904,Iniciativas de Investigación Estudiantiles,Ingeniería,,,10
3185,ING0905,Cmd Iniciativas de Investigación en Pregrado,Ingeniería,,,10
3186,ING0906,Cmd Investigación o Proyecto Interdisciplinario,Ingeniería,,,10
3187,ING0914,Iniciativas de Investigación Estudiantiles,Ingeniería,,,10
3188,ING0915,Cmd Iniciativas de Investigación en Pregrado,Ingeniería,,,10
3189,ING0916,Cmd Investigación o Proyecto Interdisciplinario,Ingeniería,,,10
3190,ING1001,Práctica I,Ingeniería,,,0
3191,ING1004,Desafíos de la Ingeniería,Ingeniería,,,10
3192,ING2001,Práctica II,Ingeniería,,,0
3193,ING2005,Taller de Empleabilidad,Ingeniería,,,0
3194,ING2030,"Investigación, Innovación y Emprendimiento",Ingeniería,,,10
3195,ING3100,Convenio Universidad de Chile,Ingeniería,,,10
3196,ING3110,Convenio Universidad de Chile,Ingeniería,,,10
3197,ING3200,Convenio Universidad Técnica Federico Santa María,Ingeniería,,,10
3198,ING3300,Convenio Universidad de Santiago de Chile,Ingeniería,,,10
3199,ING3810,Seminario de Postgrado: Propuesta de Tesis,Ingeniería,,Cursos orientados a la Investi,10
3200,ING3820,Seminario de Postgrado I,Ingeniería,,Cursos orientados a la Investi,5
3201,ING3821,Seminario de Postgrado II,Ingeniería,,,5
3202,ING4921,Tesis de Postgrado,Ingeniería,,Cursos orientados a la Investi,10
3203,ING4922,Tesis de Postgrado,Ingeniería,,Cursos orientados a la Investi,10
3204,ING4923,Tesis de Postgrado,Ingeniería,,Cursos orientados a la Investi,10
3205,ING4926,Tesis de Postgrado,Ingeniería,,Cursos orientados a la Investi,20
3206,ING4927,Tesis de Postgrado,Ingeniería,,Cursos orientados a la Investi,20
3207,ING4928,Tesis de Postgrado,Ingeniería,,Cursos orientados a la Investi,20
3208,ING4941,Proyecto de Tesis I,Ingeniería,,Cursos orientados a la Investi,10
3209,ING4942,Proyecto de Tesis II,Ingeniería,,Cursos orientados a la Investi,10
3210,ING4943,Proyecto de Tesis III,Ingeniería,,Cursos orientados a la Investi,20
3211,ING4944,Proyecto de Tesis IV,Ingeniería,,Cursos orientados a la Investi,30
3212,ING4961,Tesis de Doctorado I,Ingeniería,,Cursos orientados a la Investi,50
3213,ING4962,Tesis de Doctorado II,Ingeniería,,Cursos orientados a la Investi,50
3214,ING4963,Tesis de Doctorado III,Ingeniería,,Cursos orientados a la Investi,50
3215,ING4970,Actividad de Graduacion,Ingeniería,,Cursos orientados a la Investi,30
3216,ING5050,Manuscrito Proyecto de Tesis,Ingeniería,,Cursos orientados a la Investi,0
3217,ING5100,Examen de Candidatura,Ingeniería,,Cursos orientados a la Investi,0
3218,ING5110,Examen de Candidatura,Ingeniería,,,0
3219,ING5200,Actividad Anual de Seguimiento I,Ingeniería,,Cursos orientados a la Investi,0
3220,ING5210,Actividad Anual de Seguimiento II,Ingeniería,,Cursos orientados a la Investi,0
3221,ING5220,Actividad Anual de Seguimiento III,Ingeniería,,,0
3222,ING5240,Pasantía Internacional,Ingeniería,,Cursos orientados a la Investi,0
3223,ING5250,Autoría Artículo Científico o Patente,Ingeniería,,Cursos orientados a la Investi,0
3224,ING5300,Documento Tesis Doctoral,Ingeniería,,Cursos orientados a la Investi,0
3225,ING5400,Defensa de Tesis Doctoral,Ingeniería,,Cursos orientados a la Investi,0
3226,MHE1000,Hematologia Ia,Escuela De Medicina,,,35
3227,MHE1020,Hematologia Iia,Escuela De Medicina,,,35
3228,MHP3000,Hematologia y Oncologia Pediatrica I a,Escuela De Medicina,,,35
3229,MHP3022,Hematologia y Oncologia Pediatrica Iia,Escuela De Medicina,,,35
3230,MPH3000,Fundamentos de la Salud Pública,Escuela De Medicina,,,10
3231,MPH3001,Bases Epidemiológicas de la Salud Pública,Escuela De Medicina,,,10
3232,MPH3002,Bioestadística en Salud Pública,Escuela De Medicina,,,10
3233,MPH3003,Ética y Salud Pública,Escuela De Medicina,,,5
3234,MPH3009,Estrategias de Promoción y Prevención en Salud,Escuela De Medicina,,,5
3235,MPH3010,Ciencias Sociales y del Comportamiento en Salud,Escuela De Medicina,,,5
3236,MPH3011,Proyecto de Salud Pública,Escuela De Medicina,,,20
3237,MPH3012,"Desafíos del Adulto Mayor, Enfoque Interdisciplinario Desde la Gerontología y Epidemiología Social",Escuela De Medicina,,,10
3238,MPH3013,Ciencias de Implementación y Evaluación de Servicios & Programas de Salud,Escuela De Medicina,,,10
3239,IHI0101,Introducción a la Historia,Historia,,,10
3240,IHI0102,Teoría de la Historia,Historia,,,10
3241,IHI0103,Historia de la Historiografía,Historia,,,10
3242,IHI0201,Historia Antigua,Historia,,,10
3243,IHI0203,Historia Moderna,Historia,,,10
3244,IHI0204,Historia Contemporánea S. XIX,Historia,,,10
3245,IHI0205,Historia Mundial Contemporánea,Historia,,,10
3246,IHI0211,Chile y América Indígena,Historia,Humanidades,,10
3247,IHI0212,Historia de Chile Colonial,Historia,,,10
3248,IHI0213,Historia de Chile S. XIX,Historia,,,10
3249,IHI0214,Historia de Chile Contemporáneo,Historia,,,10
3250,IHI0221,Imperios y Encuentros del Mundo Atlántico: Siglos Xv y XVI,Historia,,,10
3251,IHI0223,Historia de América S. XIX,Historia,,,10
3252,IHI0224,Historia de América Contemporánea,Historia,,,10
3253,IHI0311,Monografía de Licenciatura,Historia,,,10
3254,IHI0401,Educación Histórica: Teorías y Prácticas,Historia,,,10
3255,IHI0441,"Historia Pública: Audiencias, Formatos y Trabajo Colaborativo",Historia,,,10
3256,IHI0491,Estrategias de Comunicación Digital para la Historia Pública,Historia,,,10
3257,IHI0508,Rock Chileno y Mundo Contemporáneo. 1950-2000.,Historia,,,10
3258,IHI0513,Moda y Sociedad en Chile en el Siglo XX,Historia,,,10
3259,IHI0516,"Ser Ciudadanos/As Ayer y Hoy: Estado, Democracia y Constitución en Chile y el Mundo",Historia,Humanidades,,10
3260,IHI0518,Los Griegos y Nosotros,Historia,Humanidades,,10
3261,IHI0519,Músicas Latinoamericanas,Historia,Humanidades,,10
3262,IHI0523,"Antropología Americana: Habitar, Reivindicar y Reconocer",Historia,Humanidades,,10
3263,IHI0539,Conflictos Armados y Construcción de Paz en África Subsahariana,Historia,Humanidades,,10
3264,IHI2307,Archivos e Historia,Historia,,,10
3265,IHI2316,Asia: Historia y Cultura,Historia,,,10
3266,IHI2322,Religión y la Construcción de Asia Oriental,Historia,,,10
3267,IHI2323,Historia de Género en Chile,Historia,Humanidades,,10
3268,IHI2325,"Género y Sexualidad en Revoluciones y Dictaduras Latinoamericanas, 1959-Presente",Historia,,,10
3269,IHI2326,Propuesta de Interpretación Interdisciplinaria de Imágenes,Historia,,,10
3270,IHI2327,El Ambiente Como Problema Histórico en Chile,Historia,,,10
3271,IHI3010,Metodología de la Investigación,Historia,,,10
3272,IHI3011,Historia de la Historiografía,Historia,,,10
3273,IHI3013,Tesis I,Historia,,,30
3274,IHI3018,Trayectoria y Conceptos de la Historia Pública,Historia,,,10
3275,IHI3019,Taller Ética e Historia,Historia,,,10
3276,IHI301A,Seminario I Parte a,Historia,,,10
3277,IHI3021,Gestión de Proyectos,Historia,,,20
3278,IHI3023,Humanidades Digitales,Historia,,,10
3279,IHI3026,Historia Pública y Turismo,Historia,,,10
3280,IHI3028,Dimensión Política de la Historia,Historia,,,10
3281,IHI4801,Lecturas Avanzadas de Historia,Historia,,,10
3282,IHI4803,Lecturas Avanzadas de Historia III,Historia,,,10
3283,IHI4921,Teoria y Metodo de la Historia I,Historia,,,10
3284,IHI4923,Teoria y Metodo de la Historia III,Historia,,,10
3285,IHI4931,Seminario de Tesis I,Historia,,,20
3286,IHI4933,Seminario de Tesis III,Historia,,,20
3287,IHI4958,Tesis Doctoral I,Historia,,,50
3288,IHI4960,Tesis Doctoral III,Historia,,,50
3289,IHI4964,Pasantía,Historia,,,0
3290,IHI4965,Artículo,Historia,,,0
3291,MUC901H,Fagot 1,Música,,,10
3292,MUC903H,Fagot 3,Música,,,15
3293,MUC905H,Fagot 5,Música,,,15
3294,MUC907H,Fagot 7,Música,,,20
3295,MUC909H,Fagot 9,Música,,,20
3296,MUC911H,Fagot 11,Música,,,25
3297,MIA1000,Medicina Intensiva Adulto Ia,Escuela De Medicina,,,35
3298,MIA1020,Medicina Intensiva Adulto Iia,Escuela De Medicina,,,35
3299,MIA3000,Medicina Intensiva del Adulto Ib,Escuela De Medicina,,,70
3300,MIA3002,Medicina Intensiva del Adulto Iia,Escuela De Medicina,,,70
3301,MIA3003,Medicina Intensiva del Adulto Iib,Escuela De Medicina,,,70
3302,MIC1000,Inmunologia Clinica y Reumatologia Ia,Escuela De Medicina,,,35
3303,MIC1020,Inmunologia Clinica y Reumatologia Iia,Escuela De Medicina,,,35
3304,IIC0020,Investigacion o Proyecto,Ingeniería,,,20
3305,IIC1001,Algoritmos y Sistemas Computacionales,Ingeniería,,,5
3306,IIC1005,Computación: Ciencia y Tecnología del Mundo Digital,Ingeniería,,,10
3307,IIC1062,Introduccion a  las Aplicaciones Computacionales,Ingeniería,,,10
3308,IIC1103,Introducción a la Programación,Ingeniería,,,10
3309,IIC1253,Matemáticas Discretas,Ingeniería,,,10
3310,IIC2026,Visualización de Información,Ingeniería,,,10
3311,IIC2113,Diseño Detallado de Software,Ingeniería,,,10
3312,IIC2115,Programación Como Herramienta para la Ingeniería,Ingeniería,,,10
3313,IIC2133,Estructuras de Datos y Algoritmos,Ingeniería,,,10
3314,IIC2143,Ingeniería de Software,Ingeniería,,,10
3315,IIC2154,Proyecto de Especialidad,Ingeniería,,,10
3316,IIC2173,Arquitectura de Sistemas de Software,Ingeniería,,,10
3317,IIC2213,Lógica para Ciencias de la Computación,Ingeniería,,,10
3318,IIC2214,Teoría de la Computación,Ingeniería,,,10
3319,IIC2233,Programación Avanzada,Ingeniería,,,10
3320,IIC2333,Sistemas Operativos y Redes,Ingeniería,,,10
3321,IIC2343,Arquitectura de Computadores,Ingeniería,,,10
3322,IIC2413,Bases de Datos,Ingeniería,,,10
3323,IIC2433,Minería de Datos,Ingeniería,,,10
3324,IIC2440,Procesamiento de Datos Masivos,Ingeniería,,,10
3325,IIC2513,Tecnologías y Aplicaciones Web,Ingeniería,,,10
3326,IIC2552,Taller de Programacion Avanzada,Ingeniería,,,5
3327,IIC2560,Fundamentos de Lenguajes de Programación,Ingeniería,,,10
3328,IIC2613,Inteligencia Artificial,Ingeniería,,,10
3329,IIC2685,Robótica Móvil,Ingeniería,,,10
3330,IIC2713,Sistemas de Información,Ingeniería,,,10
3331,IIC2714,Fundamentos de Procesamiento de Imágenes,Ingeniería,,,10
3332,IIC2733,Modelos de Procesos,Ingeniería,,Aprendizaje Servicio,10
3333,IIC2764,"Conocimiento, Cultura y Tecnología",Ingeniería,,,10
3334,IIC2972,Trabajo Personal Dirigido,Ingeniería,,,5
3335,IIC2981,Trabajo Personal Dirigido,Ingeniería,,,5
3336,IIC2985,Investigacion o Proyecto,Ingeniería,,,10
3337,IIC2986,Investigacion o Proyecto,Ingeniería,,,10
3338,IIC2987,Investigacion o Proyecto,Ingeniería,,,10
3339,IIC2988,Investigación o Proyecto (Optativo de Titulación),Ingeniería,,,10
3340,IIC3103,Taller de Integración,Ingeniería,,,10
3341,IIC3104,Taller de Integración (Proyecto de Título),Ingeniería,,,10
3342,IIC3113,Gestión de Proyectos de Tecnologías de Información,Ingeniería,,,10
3343,IIC3143,Desarrollo de Software,Ingeniería,,,10
3344,IIC3144,Desarrollo de Software (Proyecto de Título),Ingeniería,,,10
3345,IIC3234,Estructuras de Datos Avanzadas,Ingeniería,,,10
3346,IIC3242,Complejidad Computacional,Ingeniería,,,10
3347,IIC3253,Criptografía y Seguridad Computacional,Ingeniería,,,10
3348,IIC3413,Implementación de Sistemas de Base de Datos,Ingeniería,,,10
3349,IIC3533,Computación de Alto Rendimiento,Ingeniería,,,10
3350,IIC3585,Diseño Avanzado de Aplicaciones Web,Ingeniería,,,10
3351,IIC3633,Sistemas Recomendadores,Ingeniería,,,10
3352,IIC3675,Aprendizaje Reforzado,Ingeniería,,,10
3353,IIC3697,Aprendizaje Profundo,Ingeniería,,,10
3354,IIC3703,Gestión de Operaciones Ti,Ingeniería,,,10
3355,IIC3724,Reconocimiento de Patrones,Ingeniería,,,10
3356,IIC3743,Estrategias y Tecnologías de Información,Ingeniería,,,10
3357,IIC3745,Testing,Ingeniería,,,10
3358,IIC3753,Tecnologias para Gestion Estrategica,Ingeniería,,,10
3359,IIC3757,Minería de Procesos,Ingeniería,,,10
3360,IIC3964,Desarrollo de Sistemas Complejos (Proyecto de Título),Ingeniería,,,10
3361,TID201,"Espiritualidad, Discapacidad e Inclusión (A+S)",Teología,Ciencias Sociales,Aprendizaje Servicio,10
3362,MIF3010,Fundamentos de Finanzas,Economía Y Administración,,,5
3363,MIF3070,Tópicos de Inversiones,Economía Y Administración,,,5
3364,MIF3080,Tópicos de Finanzas Corporativas,Economía Y Administración,,,5
3365,MIF3100,Taller de Finanzas Aplicadas II (Finanzas Corporativas),Economía Y Administración,,,5
3366,MIF3120,Actividad Final de Graduación II,Economía Y Administración,,,10
3367,MIF3230,Instrumentos de Renta Fija,Economía Y Administración,,,5
3368,MIF3260,Gobierno Corporativo y Responsabilidad Social,Economía Y Administración,,,5
3369,MIF3020,Preparación y Análisis de Estados Financieros,Ingeniería,,,5
3370,MIF3030,Decisiones de Inversión,Ingeniería,,,5
3371,MIF3040,Valoración Financiera,Ingeniería,,,5
3372,MIF3090,Taller de Finanzas Aplicadas I (Inversiones),Ingeniería,,,5
3373,MIF3110,Actividad Final de Graduación I,Ingeniería,,,10
3374,MIF3210,Derivados Financieros,Ingeniería,,,5
3375,MIF3240,Evaluación de Proyectos,Ingeniería,,,5
3376,QIF101A,Fármaco-Química I,Química,,,10
3377,QIF102A,Fármaco-Química II,Química,,,10
3378,QIF103A,Fármaco-Química III,Química,,,10
3379,QIF104A,Farmacocinética y Bio-Farmacia,Química,,,10
3380,QIF105A,Tecnología Farmacéutica I,Química,,,10
3381,QIF106A,Tecnología Farmacéutica II,Química,,,10
3382,QIF107,Legislacion y Deontologia Farmaceutica,Química,,,5
3383,QIF108,Toxicologia,Química,,,10
3384,QIF109A,Farmacia Privada,Química,,,10
3385,QIF110A,Farmacia Clínica y Atención Farmacéutica,Química,,,10
3386,QIF111A,Farmacología III,Química,,,10
3387,QIF112A,Internado Clínico,Química,,,10
3388,QIF113A,Practica Profesional I,Química,,,0
3389,QIF114A,Práctica Profesional II,Química,,,0
3390,QIF115A,Botánica y Farmacognosia,Química,,,10
3391,QIF116,Farmacologia II,Química,,,10
3392,QIF117,El Mundo de los Medicamentos,Química,,Aprendizaje Servicio,10
3393,QIF118A,Bioquímica Clínica,Química,,,10
3394,QIF150,Farmacología I,Química,,,10
3395,QIF400,Tesis de Grado,Química,,,40
3396,MII1000,Medicina Intensiva Infantil Ia,Escuela De Medicina,,,35
3397,MII1020,Medicina Intensiva Infantil Iia,Escuela De Medicina,,,35
3398,IIQ0020,Investigacion o Proyecto,Ingeniería,,,20
3399,IIQ1001,Introducción a la Ingeniería Química,Ingeniería,,,10
3400,IIQ1003,Termodinámica,Ingeniería,,,10
3401,IIQ2003,Fenómenos de Transporte,Ingeniería,,,10
3402,IIQ2013,Operaciones Unitarias I,Ingeniería,,,10
3403,IIQ2023,Operaciones Unitarias II,Ingeniería,,,10
3404,IIQ2043,Fisicoquímica,Ingeniería,,,10
3405,IIQ2133,Procesos Químicos,Ingeniería,,,10
3406,IIQ213Q,Operaciones Unitarias I,Ingeniería,,,10
